{
  "schema_version": "1.0",
  "session_id": "10000000-0000-4000-8000-000000000002",
  "project_id": "reference_agent",
  "state": "USER_REVIEW",
  "created_at": "2026-08-13T12:00:00Z",
  "updated_at": "2026-08-13T12:03:00Z",
  "candidate_id": "10000000-0000-4000-8000-000000000001",
  "events": [
    {"schema_version": "1.0", "event_id": "10000000-0000-4000-8000-000000000010", "session_id": "10000000-0000-4000-8000-000000000002", "sequence": 1, "occurred_at": "2026-08-13T12:00:00Z", "from_state": null, "to_state": "DRAFTING", "event_type": "SESSION_CREATED", "actor_type": "USER", "summary": "Agent session created."},
    {"schema_version": "1.0", "event_id": "10000000-0000-4000-8000-000000000011", "session_id": "10000000-0000-4000-8000-000000000002", "sequence": 2, "occurred_at": "2026-08-13T12:02:00Z", "from_state": "DRAFTING", "to_state": "SPECIFICATION_READY", "event_type": "SPECIFICATION_PREPARED", "actor_type": "AGENT", "summary": "Candidate specification passed structural validation.", "candidate_digest": "aaaaaaaaaaaaaaaaaaaaaaaaaaaaaaaaaaaaaaaaaaaaaaaaaaaaaaaaaaaaaaaa"},
    {"schema_version": "1.0", "event_id": "10000000-0000-4000-8000-000000000012", "session_id": "10000000-0000-4000-8000-000000000002", "sequence": 3, "occurred_at": "2026-08-13T12:03:00Z", "from_state": "SPECIFICATION_READY", "to_state": "USER_REVIEW", "event_type": "REVIEW_STARTED", "actor_type": "SYSTEM", "summary": "Candidate presented for authorized review.", "candidate_digest": "aaaaaaaaaaaaaaaaaaaaaaaaaaaaaaaaaaaaaaaaaaaaaaaaaaaaaaaaaaaaaaaa"}
  ]
}
